root@r:/home/jovyan# tcpdump -l -i r-eth0
tcpdump: verbose output suppressed, use -v or -vv for full protocol decode
listening on r-eth0, link-type EN10MB (Ethernet), capture size 262144 bytes
12:41:29.951351 IP6 fe80::4807:2ff:fe66:d816 > ip6-allrouters: ICMP6, router solicitation, length 16
12:41:38.143524 IP6 fe80::d860:39ff:fe9b:b065 > ip6-allrouters: ICMP6, router solicitation, length 16
12:42:51.053442 ARP, Request who-has r-net1 tell h1, length 28
12:42:51.053526 ARP, Reply r-net1 is-at da:60:39:9b:b0:65 (oui Unknown), length 28
12:42:51.053538 IP h1.37491 > dns.domain: 47188+ A? www.csc.uvic.ca. (33)
12:42:51.234433 IP dns.domain > h1.37491: 47188 1/0/0 A 142.104.71.42 (49)
12:42:51.235367 IP h1.50160 > dns.domain: 52277+ AAAA? www.csc.uvic.ca. (33)
12:42:51.251987 IP dns.domain > h1.50160: 52277 0/1/0 (100)
12:42:56.479339 ARP, Request who-has h1 tell r-net1, length 28
12:42:56.479423 ARP, Reply h1 is-at 4a:07:02:66:d8:16 (oui Unknown), length 28
12:43:04.780450 IP h1.44311 > dns.domain: 40318+ A? www.ibm.com. (29)
12:43:06.775345 IP dns.domain > h1.44311: 40318 4/0/0 CNAME www.ibm.com.cs186.net., CNAME outer-global-dual.ibmcom-tls12.edgekey.net., CNAME e7817.dscx.akamaiedge.net., A 104.86.237.27 (175)
12:43:06.776116 IP h1.55472 > dns.domain: 4044+ AAAA? e7817.dscx.akamaiedge.net. (43)
12:43:06.780564 IP dns.domain > h1.55472: 4044 2/0/0 AAAA 2001:569:139:18c::1e89, AAAA 2001:569:139:19e::1e89 (99)
^C
14 packets captured
14 packets received by filter
0 packets dropped by kernel




///////////////////////////////////////////////////////////////////////////////////////////////////////
ITERATIVE


(base) jovyan@piconet:~$ sudo tcpdump -n -l -i host-nat udp port 53
tcpdump: verbose output suppressed, use -v or -vv for full protocol decode
listening on host-nat, link-type EN10MB (Ethernet), capture size 262144 bytes
12:42:51.058427 IP 172.16.1.1.56845 > 198.41.0.4.53: 45975 [1au] A? _.ca. (45)
12:42:51.064416 IP 198.41.0.4.53 > 172.16.1.1.56845: 45975-| 0/6/4 (505)
12:42:51.079587 IP 172.16.1.1.38896 > 185.159.196.2.53: 18963 [1au] A? _.uvic.ca. (50)
12:42:51.084244 IP 185.159.196.2.53 > 172.16.1.1.38896: 18963-| 0/6/1 (415)
12:42:51.101784 IP 172.16.1.1.48164 > 142.104.6.1.53: 31817 [1au] A? _.csc.uvic.ca. (54)
12:42:51.102502 IP 142.104.6.1.53 > 172.16.1.1.48164: 31817 NXDomain* 0/1/1 (123)
12:42:51.103126 IP 172.16.1.1.56712 > 199.4.144.2.53: 10935 [1au] DS? uvic.ca. (48)
12:42:51.134905 IP 199.4.144.2.53 > 172.16.1.1.56712: 10935*-| 0/4/1 (424)
12:42:51.207385 IP 172.16.1.1.35560 > 198.182.167.1.53: 10341 [1au] DNSKEY? ca. (43)
12:42:51.213899 IP 198.182.167.1.53 > 172.16.1.1.35560: 10341*-| 0/0/1 (31)
12:42:51.232677 IP 172.16.1.1.55998 > 192.203.230.10.53: 29446% [1au] AAAA? dns1.uvic.ca. (53)
12:42:51.232693 IP 172.16.1.1.47165 > 142.104.6.1.53: 24109 [1au] A? www.csc.uvic.ca. (72)
12:42:51.233196 IP 172.16.1.1.50651 > 192.203.230.10.53: 41873% [1au] AAAA? ns3.uvic.ca. (52)
12:42:51.233550 IP 172.16.1.1.37253 > 192.203.230.10.53: 29475% [1au] AAAA? dns2.uvic.ca. (53)
12:42:51.233722 IP 142.104.6.1.53 > 172.16.1.1.47165: 24109* 1/5/6 A 142.104.71.42 (265)
12:42:51.237010 IP 192.203.230.10.53 > 172.16.1.1.55998: 29446-| 0/6/3 (497)
12:42:51.237229 IP 192.203.230.10.53 > 172.16.1.1.50651: 41873-| 0/6/4 (512)
12:42:51.237382 IP 172.16.1.1.34080 > 142.104.6.1.53: 149 [1au] A? _.csc.uvic.ca. (70)
12:42:51.237652 IP 192.203.230.10.53 > 172.16.1.1.37253: 29475-| 0/6/3 (497)
12:42:51.238247 IP 142.104.6.1.53 > 172.16.1.1.34080: 149 NXDomain* 0/1/1 (123)
12:42:51.243017 IP 172.16.1.1.40567 > 142.104.80.2.53: 32313 [1au] AAAA? www.csc.uvic.ca. (56)
12:42:51.244084 IP 142.104.80.2.53 > 172.16.1.1.40567: 32313* 0/1/1 (125)
12:42:51.245867 IP 172.16.1.1.56874 > 199.253.250.68.53: 65077% [1au] AAAA? dns1.uvic.ca. (53)
12:42:51.252274 IP 172.16.1.1.41026 > 199.253.250.68.53: 35186% [1au] AAAA? ns3.uvic.ca. (52)
12:42:51.253202 IP 172.16.1.1.60857 > 199.253.250.68.53: 59600% [1au] AAAA? dns2.uvic.ca. (53)
12:42:51.413638 IP 199.253.250.68.53 > 172.16.1.1.56874: 65077-| 0/6/1 (418)
12:42:51.419738 IP 199.253.250.68.53 > 172.16.1.1.41026: 35186-| 0/6/1 (413)
12:42:51.420946 IP 199.253.250.68.53 > 172.16.1.1.60857: 59600-| 0/6/1 (418)
12:42:51.750023 IP 172.16.1.1.44253 > 216.171.224.23.53: 11053% [1au] AAAA? dns1.uvic.ca. (53)
12:42:51.756482 IP 172.16.1.1.57666 > 216.171.224.23.53: 10245% [1au] AAAA? ns3.uvic.ca. (52)
12:42:51.757268 IP 172.16.1.1.55566 > 216.171.224.23.53: 30156% [1au] AAAA? dns2.uvic.ca. (53)
12:42:52.546791 IP 172.16.1.1.44256 > 142.104.6.1.53: 47439% [1au] AAAA? dns1.uvic.ca. (69)
12:42:52.547786 IP 142.104.6.1.53 > 172.16.1.1.44256: 47439* 0/1/1 (114)
12:42:52.555567 IP 172.16.1.1.47762 > 142.104.6.1.53: 49715% [1au] AAAA? dns2.uvic.ca. (69)
12:42:52.555881 IP 172.16.1.1.47475 > 142.104.6.1.53: 13241% [1au] AAAA? ns3.uvic.ca. (68)
12:42:52.556415 IP 142.104.6.1.53 > 172.16.1.1.47762: 49715* 0/1/1 (119)
12:42:52.556495 IP 142.104.6.1.53 > 172.16.1.1.47475: 13241* 0/1/1 (118)
12:43:04.783604 IP 172.16.1.1.33746 > 192.58.128.30.53: 60018 [1au] A? _.com. (46)
12:43:04.787903 IP 192.58.128.30.53 > 172.16.1.1.33746: 60018-| 0/13/1 (258)
12:43:04.797294 IP 172.16.1.1.49455 > 192.35.51.30.53: 53778 [1au] A? _.ibm.com. (50)
12:43:04.854194 IP 192.35.51.30.53 > 172.16.1.1.49455: 53778-| 0/10/1 (479)
12:43:04.969967 IP 172.16.1.1.41206 > 198.97.190.53.53: 41470% [1au] A? usc2.akam.net. (54)
12:43:04.970529 IP 172.16.1.1.37106 > 198.97.190.53.53: 7905% [1au] AAAA? usc2.akam.net. (54)
12:43:04.970898 IP 172.16.1.1.47080 > 198.97.190.53.53: 52493% [1au] A? usc3.akam.net. (54)
12:43:04.971107 IP 172.16.1.1.36922 > 198.97.190.53.53: 59877% [1au] A? eur2.akam.net. (54)
12:43:04.971369 IP 172.16.1.1.49609 > 198.97.190.53.53: 901% [1au] AAAA? usc3.akam.net. (54)
12:43:04.971757 IP 172.16.1.1.46826 > 198.97.190.53.53: 60243% [1au] AAAA? eur2.akam.net. (54)
12:43:04.972156 IP 172.16.1.1.48569 > 198.97.190.53.53: 3503% [1au] A? eur5.akam.net. (54)
12:43:04.972574 IP 172.16.1.1.38836 > 198.97.190.53.53: 7164% [1au] AAAA? eur5.akam.net. (54)
12:43:04.972939 IP 172.16.1.1.56641 > 198.97.190.53.53: 14924% [1au] A? usw2.akam.net. (54)
12:43:04.973431 IP 172.16.1.1.51921 > 198.97.190.53.53: 64618% [1au] AAAA? usw2.akam.net. (54)
12:43:05.012500 IP 198.97.190.53.53 > 172.16.1.1.41206: 41470-| 0/13/1 (263)
12:43:05.012793 IP 198.97.190.53.53 > 172.16.1.1.37106: 7905-| 0/13/1 (263)
12:43:05.013140 IP 198.97.190.53.53 > 172.16.1.1.47080: 52493-| 0/13/1 (263)
12:43:05.013572 IP 198.97.190.53.53 > 172.16.1.1.36922: 59877-| 0/13/1 (263)
12:43:05.013674 IP 198.97.190.53.53 > 172.16.1.1.49609: 901-| 0/13/1 (263)
12:43:05.014086 IP 198.97.190.53.53 > 172.16.1.1.46826: 60243-| 0/13/1 (263)
12:43:05.014512 IP 198.97.190.53.53 > 172.16.1.1.48569: 3503-| 0/13/1 (263)
12:43:05.014836 IP 198.97.190.53.53 > 172.16.1.1.38836: 7164-| 0/13/1 (263)
12:43:05.015152 IP 198.97.190.53.53 > 172.16.1.1.56641: 14924-| 0/13/1 (263)
12:43:05.015751 IP 198.97.190.53.53 > 172.16.1.1.51921: 64618-| 0/13/1 (263)
12:43:05.102781 IP 172.16.1.1.42810 > 192.42.93.30.53: 43672% [1au] AAAA? usc3.akam.net. (54)
12:43:05.102788 IP 172.16.1.1.37683 > 192.42.93.30.53: 38722% [1au] AAAA? eur5.akam.net. (54)
12:43:05.103058 IP 172.16.1.1.33770 > 192.42.93.30.53: 41155% [1au] A? usc3.akam.net. (54)
12:43:05.103499 IP 172.16.1.1.44648 > 192.42.93.30.53: 17837% [1au] AAAA? eur2.akam.net. (54)
12:43:05.103656 IP 172.16.1.1.50245 > 192.42.93.30.53: 21833% [1au] A? usc2.akam.net. (54)
12:43:05.104065 IP 172.16.1.1.56789 > 192.42.93.30.53: 40464% [1au] AAAA? usc2.akam.net. (54)
12:43:05.104588 IP 172.16.1.1.56091 > 192.42.93.30.53: 39738% [1au] A? eur2.akam.net. (54)
12:43:05.105102 IP 172.16.1.1.60974 > 192.42.93.30.53: 31840% [1au] A? eur5.akam.net. (54)
12:43:05.105606 IP 172.16.1.1.40021 > 192.42.93.30.53: 53404% [1au] A? usw2.akam.net. (54)
12:43:05.106035 IP 172.16.1.1.35915 > 192.42.93.30.53: 21468% [1au] AAAA? usw2.akam.net. (54)
12:43:05.160088 IP 192.42.93.30.53 > 172.16.1.1.42810: 43672-| 0/15/2 (483)
12:43:05.160210 IP 192.42.93.30.53 > 172.16.1.1.50245: 21833-| 0/15/2 (483)
12:43:05.160360 IP 192.42.93.30.53 > 172.16.1.1.44648: 17837-| 0/15/2 (483)
12:43:05.162385 IP 192.42.93.30.53 > 172.16.1.1.60974: 31840-| 0/15/2 (483)
12:43:05.163368 IP 192.42.93.30.53 > 172.16.1.1.35915: 21468-| 0/15/2 (483)
12:43:05.171813 IP 192.42.93.30.53 > 172.16.1.1.37683: 38722-| 0/15/2 (483)
12:43:05.172894 IP 192.42.93.30.53 > 172.16.1.1.56789: 40464-| 0/15/2 (483)
12:43:05.172899 IP 192.42.93.30.53 > 172.16.1.1.40021: 53404-| 0/15/2 (483)
12:43:05.172901 IP 192.42.93.30.53 > 172.16.1.1.56091: 39738-| 0/15/2 (483)
12:43:05.172903 IP 192.42.93.30.53 > 172.16.1.1.33770: 41155-| 0/15/2 (483)
12:43:05.276687 IP 172.16.1.1.44809 > 72.246.46.67.53: 38351% [1au] A? usc2.akam.net. (54)
12:43:05.278698 IP 172.16.1.1.39280 > 72.246.46.67.53: 35248% [1au] AAAA? usw2.akam.net. (54)
12:43:05.279578 IP 172.16.1.1.41758 > 72.246.46.67.53: 52626% [1au] A? eur5.akam.net. (54)
12:43:05.285351 IP 172.16.1.1.48803 > 72.246.46.67.53: 60320% [1au] AAAA? usc3.akam.net. (54)
12:43:05.287597 IP 172.16.1.1.33610 > 72.246.46.67.53: 25689% [1au] AAAA? eur2.akam.net. (54)
12:43:05.288120 IP 172.16.1.1.49011 > 72.246.46.67.53: 53753% [1au] AAAA? usc2.akam.net. (54)
12:43:05.288909 IP 172.16.1.1.33808 > 72.246.46.67.53: 8122% [1au] A? usw2.akam.net. (54)
12:43:05.290455 IP 172.16.1.1.52179 > 72.246.46.67.53: 65093% [1au] A? usc3.akam.net. (54)
12:43:05.290676 IP 172.16.1.1.37457 > 72.246.46.67.53: 33944% [1au] AAAA? eur5.akam.net. (54)
12:43:05.293218 IP 172.16.1.1.55507 > 72.246.46.67.53: 31073% [1au] A? eur2.akam.net. (54)
12:43:05.343176 IP 72.246.46.67.53 > 172.16.1.1.44809: 38351*- 1/0/1 A 184.26.160.64 (58)
12:43:05.343616 IP 172.16.1.1.55577 > 184.26.160.64.53: 25789 [1au] A? www.ibm.com. (52)
12:43:05.343902 IP 172.16.1.1.50339 > 23.211.133.67.53: 20396% [1au] A? asia3.akam.net. (55)
12:43:05.344065 IP 172.16.1.1.58600 > 23.211.133.67.53: 16964% [1au] AAAA? asia3.akam.net. (55)
12:43:05.344428 IP 72.246.46.67.53 > 172.16.1.1.39280: 35248*- 0/1/1 (108)
12:43:05.346128 IP 72.246.46.67.53 > 172.16.1.1.41758: 52626*- 1/0/1 A 23.74.25.64 (58)
12:43:05.350476 IP 184.26.160.64.53 > 172.16.1.1.55577: 25789*- 1/0/1 CNAME www.ibm.com.cs186.net. (75)
12:43:05.350994 IP 72.246.46.67.53 > 172.16.1.1.48803: 60320*- 0/1/1 (108)
12:43:05.351528 IP 172.16.1.1.42316 > 192.55.83.30.53: 9860 [1au] DS? ibm.com. (48)
12:43:05.353492 IP 72.246.46.67.53 > 172.16.1.1.33610: 25689*- 0/1/1 (108)
12:43:05.354103 IP 72.246.46.67.53 > 172.16.1.1.49011: 53753*- 0/1/1 (108)
12:43:05.355294 IP 72.246.46.67.53 > 172.16.1.1.33808: 8122*- 1/0/1 A 184.26.161.64 (58)
12:43:05.356303 IP 72.246.46.67.53 > 172.16.1.1.37457: 33944*- 0/1/1 (108)
12:43:05.357146 IP 72.246.46.67.53 > 172.16.1.1.52179: 65093*- 1/0/1 A 96.7.50.64 (58)
12:43:05.359141 IP 72.246.46.67.53 > 172.16.1.1.55507: 31073*- 1/0/1 A 95.100.173.64 (58)
12:43:05.403837 IP 192.55.83.30.53 > 172.16.1.1.42316: 9860*-| 0/4/1 (463)
12:43:05.407895 IP 23.211.133.67.53 > 172.16.1.1.58600: 16964*- 0/1/1 (109)
12:43:05.408105 IP 23.211.133.67.53 > 172.16.1.1.50339: 20396*- 1/0/1 A 23.211.61.64 (59)
12:43:05.497065 IP 172.16.1.1.55987 > 192.12.94.30.53: 27499 [1au] DNSKEY? com. (44)
12:43:05.503268 IP 192.12.94.30.53 > 172.16.1.1.55987: 27499*-| 2/0/1 DNSKEY, DNSKEY (486)
12:43:05.518358 IP 172.16.1.1.41559 > 192.5.6.30.53: 51768 [1au] A? _.cs186.net. (52)
12:43:05.524270 IP 192.5.6.30.53 > 172.16.1.1.41559: 51768-| 0/6/1 (463)
12:43:05.540152 IP 172.16.1.1.47874 > 192.54.112.30.53: 17261% [1au] A? ns1.events.ihost.com. (61)
12:43:05.540175 IP 172.16.1.1.47667 > 192.54.112.30.53: 58333% [1au] A? ns.events.ihost.com. (60)
12:43:05.540782 IP 172.16.1.1.44329 > 192.54.112.30.53: 58160% [1au] AAAA? ns1.events.ihost.com. (61)
12:43:05.541247 IP 172.16.1.1.41016 > 192.54.112.30.53: 608% [1au] A? ns2.events.ihost.com. (61)
12:43:05.541733 IP 172.16.1.1.60841 > 192.54.112.30.53: 3460% [1au] AAAA? ns2.events.ihost.com. (61)
12:43:05.543492 IP 172.16.1.1.41013 > 192.54.112.30.53: 12823% [1au] AAAA? ns.events.ihost.com. (60)
12:43:05.596828 IP 192.54.112.30.53 > 172.16.1.1.47667: 58333-| 0/10/1 (489)
12:43:05.597529 IP 192.54.112.30.53 > 172.16.1.1.47874: 17261-| 0/10/1 (490)
12:43:05.598548 IP 192.54.112.30.53 > 172.16.1.1.41016: 608-| 0/10/1 (490)
12:43:05.599297 IP 192.54.112.30.53 > 172.16.1.1.60841: 3460-| 0/10/1 (490)
12:43:05.599896 IP 192.54.112.30.53 > 172.16.1.1.41013: 12823-| 0/10/1 (489)
12:43:05.607725 IP 192.54.112.30.53 > 172.16.1.1.44329: 58160-| 0/10/1 (490)
12:43:05.711002 IP 172.16.1.1.58823 > 96.7.49.67.53: 38736% [1au] A? ns1-99.akam.net. (56)
12:43:05.711448 IP 172.16.1.1.54354 > 184.26.161.64.53: 55433% [1au] A? ns1.events.ihost.com. (61)
12:43:05.712315 IP 172.16.1.1.35843 > 96.7.49.67.53: 55246% [1au] AAAA? ns1-99.akam.net. (56)
12:43:05.712460 IP 172.16.1.1.55795 > 96.7.49.67.53: 6376% [1au] A? ns1-206.akam.net. (57)
12:43:05.713196 IP 172.16.1.1.48666 > 96.7.49.67.53: 41021% [1au] AAAA? ns1-206.akam.net. (57)
12:43:05.714263 IP 172.16.1.1.46685 > 184.26.161.64.53: 28555% [1au] AAAA? ns2.events.ihost.com. (61)
12:43:05.714663 IP 172.16.1.1.52935 > 184.26.161.64.53: 39943% [1au] A? ns.events.ihost.com. (60)
12:43:05.715590 IP 172.16.1.1.58615 > 184.26.161.64.53: 37406% [1au] AAAA? ns.events.ihost.com. (60)
12:43:05.717464 IP 172.16.1.1.60654 > 184.26.161.64.53: 46760% [1au] A? ns2.events.ihost.com. (61)
12:43:05.721868 IP 172.16.1.1.40182 > 184.26.161.64.53: 41253% [1au] AAAA? ns1.events.ihost.com. (61)
12:43:05.747721 IP 184.26.161.64.53 > 172.16.1.1.54354: 55433- 0/3/4 (146)
12:43:05.748680 IP 172.16.1.1.51295 > 129.42.1.200.53: 6076% [1au] A? ns1.events.ihost.com. (61)
12:43:05.750548 IP 184.26.161.64.53 > 172.16.1.1.46685: 28555- 0/3/4 (146)
12:43:05.751300 IP 172.16.1.1.37886 > 129.42.1.200.53: 11400% [1au] AAAA? ns2.events.ihost.com. (61)
12:43:05.751358 IP 184.26.161.64.53 > 172.16.1.1.52935: 39943- 0/3/4 (146)
12:43:05.752128 IP 172.16.1.1.57980 > 129.42.1.200.53: 3738% [1au] A? ns.events.ihost.com. (60)
12:43:05.752725 IP 184.26.161.64.53 > 172.16.1.1.58615: 37406- 0/3/4 (146)
12:43:05.753339 IP 184.26.161.64.53 > 172.16.1.1.60654: 46760- 0/3/4 (146)
12:43:05.753408 IP 172.16.1.1.57967 > 129.42.1.200.53: 13508% [1au] AAAA? ns.events.ihost.com. (60)
12:43:05.754009 IP 172.16.1.1.57735 > 129.42.1.200.53: 19301% [1au] A? ns2.events.ihost.com. (61)
12:43:05.758372 IP 184.26.161.64.53 > 172.16.1.1.40182: 41253- 0/3/4 (146)
12:43:05.758941 IP 172.16.1.1.60080 > 129.42.1.200.53: 59704% [1au] AAAA? ns1.events.ihost.com. (61)
12:43:05.823522 IP 129.42.1.200.53 > 172.16.1.1.51295: 6076*- 1/0/1 A 129.42.1.200 (93)
12:43:05.824386 IP 172.16.1.1.57104 > 129.42.10.200.53: 50051 [1au] A? _.com.cs186.net. (56)
12:43:05.826996 IP 129.42.1.200.53 > 172.16.1.1.57980: 3738*- 1/0/1 A 129.42.3.200 (92)
12:43:05.827040 IP 129.42.1.200.53 > 172.16.1.1.37886: 11400*- 0/1/1 (128)
12:43:05.839290 IP 129.42.1.200.53 > 172.16.1.1.60080: 59704*- 0/1/1 (124)
12:43:05.842230 IP 129.42.1.200.53 > 172.16.1.1.57735: 19301*- 1/0/1 A 129.42.10.200 (93)
12:43:05.843323 IP 129.42.1.200.53 > 172.16.1.1.57967: 13508*- 0/1/1 (127)
12:43:05.952488 IP 96.7.49.67.53 > 172.16.1.1.35843: 55246*- 1/0/1 AAAA 2600:1401:2::63 (72)
12:43:05.955215 IP 96.7.49.67.53 > 172.16.1.1.58823: 38736*- 1/0/1 A 193.108.91.99 (60)
12:43:05.955326 IP 96.7.49.67.53 > 172.16.1.1.55795: 6376*- 1/0/1 A 193.108.91.206 (61)
12:43:05.957201 IP 96.7.49.67.53 > 172.16.1.1.48666: 41021*- 1/0/1 AAAA 2600:1401:2::ce (73)
12:43:05.972866 IP 129.42.10.200.53 > 172.16.1.1.57104: 50051 NXDomain*- 0/1/1 (134)
12:43:05.974227 IP 172.16.1.1.53426 > 192.31.80.30.53: 25521 [1au] DS? cs186.net. (50)
12:43:05.980187 IP 192.31.80.30.53 > 172.16.1.1.53426: 25521*-| 0/4/1 (465)
12:43:06.028763 IP 172.16.1.1.34453 > 192.33.14.30.53: 21630 [1au] DNSKEY? net. (44)
12:43:06.032450 IP 192.33.14.30.53 > 172.16.1.1.34453: 21630*-| 2/0/1 DNSKEY, DNSKEY (484)
12:43:06.042939 IP 172.16.1.1.34395 > 129.42.3.200.53: 3012 [1au] A? _.ibm.com.cs186.net. (60)
12:43:06.128440 IP 129.42.3.200.53 > 172.16.1.1.34395: 3012 NXDomain*- 0/1/1 (138)
12:43:06.129393 IP 172.16.1.1.43287 > 129.42.3.200.53: 42337 [1au] A? www.ibm.com.cs186.net. (78)
12:43:06.188157 IP 129.42.3.200.53 > 172.16.1.1.43287: 42337*- 1/0/1 CNAME outer-global-dual.ibmcom-tls12.edgekey.net. (131)
12:43:06.190064 IP 172.16.1.1.45646 > 192.43.172.30.53: 17788 [1au] A? _.edgekey.net. (54)
12:43:06.247912 IP 192.43.172.30.53 > 172.16.1.1.45646: 17788-| 0/15/2 (490)
12:43:06.370622 IP 172.16.1.1.50707 > 95.100.168.65.53: 27347 [1au] A? _.ibmcom-tls12.edgekey.net. (67)
12:43:06.397335 IP 95.100.168.65.53 > 172.16.1.1.50707: 27347 NXDomain*- 0/1/1 (118)
12:43:06.398511 IP 172.16.1.1.50718 > 192.52.178.30.53: 45435 [1au] DS? edgekey.net. (52)
12:43:06.447399 IP 192.52.178.30.53 > 172.16.1.1.50718: 45435*-| 0/4/1 (467)
12:43:06.565557 IP 172.16.1.1.52843 > 95.100.168.67.53: 18834% [1au] AAAA? usw6.akam.net. (54)
12:43:06.567437 IP 172.16.1.1.44776 > 95.100.168.67.53: 17635% [1au] AAAA? a12-65.akam.net. (56)
12:43:06.567989 IP 172.16.1.1.60274 > 95.100.168.67.53: 39929% [1au] AAAA? a13-65.akam.net. (56)
12:43:06.568337 IP 172.16.1.1.50955 > 95.100.168.67.53: 24011% [1au] AAAA? a28-65.akam.net. (56)
12:43:06.568656 IP 172.16.1.1.51929 > 95.100.168.67.53: 37252% [1au] AAAA? ns5-66.akam.net. (56)
12:43:06.568863 IP 172.16.1.1.48762 > 184.26.160.65.53: 17726 [1au] A? outer-global-dual.ibmcom-tls12.edgekey.net. (83)
12:43:06.569073 IP 172.16.1.1.46503 > 95.100.168.67.53: 20835% [1au] AAAA? ns7-65.akam.net. (56)
12:43:06.569317 IP 172.16.1.1.55444 > 95.100.168.67.53: 36119% [1au] AAAA? a5-65.akam.net. (55)
12:43:06.569678 IP 172.16.1.1.52708 > 95.100.168.67.53: 22389% [1au] AAAA? adns1.akam.net. (55)
12:43:06.570018 IP 172.16.1.1.39720 > 95.100.168.67.53: 26498% [1au] AAAA? a18-65.akam.net. (56)
12:43:06.570322 IP 172.16.1.1.51551 > 95.100.168.67.53: 1585% [1au] AAAA? ns4-66.akam.net. (56)
12:43:06.575736 IP 184.26.160.65.53 > 172.16.1.1.48762: 17726*- 1/0/1 CNAME e7817.dscx.akamaiedge.net. (107)
12:43:06.577774 IP 172.16.1.1.57404 > 192.41.162.30.53: 21064 [1au] A? _.akamaiedge.net. (57)
12:43:06.593194 IP 95.100.168.67.53 > 172.16.1.1.52843: 18834*- 0/1/1 (108)
12:43:06.593404 IP 95.100.168.67.53 > 172.16.1.1.44776: 17635*- 0/1/1 (110)
12:43:06.594055 IP 95.100.168.67.53 > 172.16.1.1.60274: 39929*- 1/0/1 AAAA 2600:1480:800::41 (72)
12:43:06.594459 IP 95.100.168.67.53 > 172.16.1.1.46503: 20835*- 0/1/1 (110)
12:43:06.594672 IP 95.100.168.67.53 > 172.16.1.1.50955: 24011*- 0/1/1 (110)
12:43:06.596116 IP 95.100.168.67.53 > 172.16.1.1.52708: 22389*- 0/1/1 (109)
12:43:06.596521 IP 95.100.168.67.53 > 172.16.1.1.51551: 1585*- 0/1/1 (110)
12:43:06.597155 IP 95.100.168.67.53 > 172.16.1.1.39720: 26498*- 0/1/1 (110)
12:43:06.598897 IP 95.100.168.67.53 > 172.16.1.1.55444: 36119*- 1/0/1 AAAA 2600:1480:b000::41 (71)
12:43:06.598939 IP 95.100.168.67.53 > 172.16.1.1.51929: 37252*- 0/1/1 (110)
12:43:06.624133 IP 192.41.162.30.53 > 172.16.1.1.57404: 21064-| 0/15/2 (493)
12:43:06.730483 IP 172.16.1.1.43377 > 2.16.40.192.53: 13138 [1au] A? _.dscx.akamaiedge.net. (62)
12:43:06.736614 IP 2.16.40.192.53 > 172.16.1.1.43377: 13138- 0/8/10 (374)
12:43:06.739384 IP 172.16.1.1.34062 > 95.100.173.192.53: 59638% [1au] AAAA? n2dscx.akamaiedge.net. (62)
12:43:06.740026 IP 172.16.1.1.46597 > 95.100.173.192.53: 61293% [1au] AAAA? n4dscx.akamaiedge.net. (62)
12:43:06.741274 IP 172.16.1.1.33080 > 23.64.3.149.53: 32251 [1au] A? e7817.dscx.akamaiedge.net. (66)
12:43:06.741570 IP 172.16.1.1.33670 > 95.100.173.192.53: 36809% [1au] AAAA? n6dscx.akamaiedge.net. (62)
12:43:06.742124 IP 172.16.1.1.38986 > 95.100.173.192.53: 48465% [1au] AAAA? n7dscx.akamaiedge.net. (62)
12:43:06.742684 IP 172.16.1.1.43459 > 95.100.173.192.53: 43984% [1au] AAAA? n1dscx.akamaiedge.net. (62)
12:43:06.743520 IP 172.16.1.1.47702 > 95.100.173.192.53: 9436% [1au] AAAA? n3dscx.akamaiedge.net. (62)
12:43:06.744362 IP 172.16.1.1.55937 > 95.100.173.192.53: 15888% [1au] AAAA? n5dscx.akamaiedge.net. (62)
12:43:06.747695 IP 23.64.3.149.53 > 172.16.1.1.33080: 32251*- 1/0/1 A 104.86.237.27 (70)
12:43:06.748639 IP 172.16.1.1.41178 > 192.26.92.30.53: 62335 [1au] DS? akamaiedge.net. (55)
12:43:06.755029 IP 192.26.92.30.53 > 172.16.1.1.41178: 62335*-| 0/4/1 (470)
12:43:06.776554 IP 172.16.1.1.56342 > 23.0.163.71.53: 12901 [1au] AAAA? e7817.dscx.akamaiedge.net. (66)
12:43:06.779953 IP 23.0.163.71.53 > 172.16.1.1.56342: 12901*- 2/0/1 AAAA 2001:569:139:19e::1e89, AAAA 2001:569:139:18c::1e89 (110)
12:43:06.875975 IP 95.100.173.192.53 > 172.16.1.1.34062: 59638*- 0/1/1 (116)
12:43:06.876220 IP 95.100.173.192.53 > 172.16.1.1.46597: 61293*- 0/1/1 (116)
12:43:06.878113 IP 95.100.173.192.53 > 172.16.1.1.33670: 36809*- 0/1/1 (116)
12:43:06.880022 IP 95.100.173.192.53 > 172.16.1.1.47702: 9436*- 0/1/1 (116)
12:43:06.880369 IP 95.100.173.192.53 > 172.16.1.1.38986: 48465*- 0/1/1 (116)
12:43:06.881133 IP 95.100.173.192.53 > 172.16.1.1.43459: 43984*- 0/1/1 (116)
12:43:06.882439 IP 95.100.173.192.53 > 172.16.1.1.55937: 15888*- 0/1/1 (116)
^C
219 packets captured
219 packets received by filter
0 packets dropped by kernel